{
    "work_order":  "REMAINING-SIX-DEEP-INVENTORY-20260617_090619",
    "area":  "Modules 026, 030, 031, 037, 039, 050",
    "branch":  "audit/remaining-six-deep-inventory-20260617_090619",
    "head_sha":  "4ddc0132416162bbf52beb63146e11e178ce1729",
    "base_sha":  "662d47842b39ffe5fac6c6048691022c5e167d34",
    "status":  "VERIFIED",
    "changed_files":  [

                      ],
    "commands_run":  [
                         {
                             "command":  "git fetch origin --prune; git switch main; git pull --ff-only origin main",
                             "result":  "PASS",
                             "output_file":  "00_prechange_packet.txt"
                         },
                         {
                             "command":  "local pattern inventory",
                             "result":  "PASS",
                             "output_file":  "02_inventory_summary.txt"
                         },
                         {
                             "command":  "python backend/manage.py check",
                             "result":  "PASS",
                             "output_file":  "05_validation_output.txt"
                         }
                     ],
    "tests_passed":  [

                     ],
    "claims_allowed":  [
                           "Remaining-six inventory packet generated",
                           "Module 026 selected as next likely proof lane"
                       ],
    "claims_forbidden":  [
                             "product completion",
                             "dashboard live-data completion",
                             "wizard functional-flow completion",
                             "deployment completion",
                             "independent approval"
                         ],
    "independent_review_required":  true,
    "evidence_files":  [
                           "00_prechange_packet.txt",
                           "01_file_universe.txt",
                           "02_inventory_summary.txt",
                           "03_explicit_proof_files.txt",
                           "04_route_api_surface.txt",
                           "05_validation_output.txt",
                           "06_decision.md"
                       ],
    "notes":  "Inventory artifact generation repaired with rg-driven per-module scans. Product completion is not claimed."
}
